"Verbo Alemão,English Translation,Exemplo Alemão"
"weitergeben,to pass on,Bitte geben Sie diese Information weiter."
"weitergehen,to continue/go on,Gehen Sie bitte weiter, hier gibt es nichts zu sehen."
"weiterhelfen,to help further,Kann ich Ihnen weiterhelfen?"
"weitermachen,to carry on/continue,Machen wir morgen weiter."
"wenden,to turn,Wenden Sie nach 200 Metern."
"werben,to advertise,Die Firma wirbt für ein neues Produkt."
"werfen,to throw,Wirf den Ball!"
"wiederholen,to repeat,Können Sie das bitte wiederholen?"
"wiegen,to weigh,Wie viel wiegst du?"
"winken,to wave,Sie winkte mir zum Abschied."
"wollen,to want to,Ich will nach Hause gehen."
"wünschen,to wish,Ich wünsche dir alles Gute."
"zahlen,to pay,Möchten Sie bar oder mit Karte zahlen?"
"zählen,to count,Zähl bis zehn!"
"zeichnen,to draw,Sie kann sehr gut Pferde zeichnen."
"zeigen,to show,Zeig mir deine Hände!"
"zerstören,to destroy,Der Krieg hat die Stadt zerstört."
"zuhören,to listen to,Hör mir gut zu!"
"zumachen,to close,Mach bitte die Tür zu."
"zunehmen,to increase/gain weight,Ich habe im Urlaub zugenommen."
"zurückgeben,to give back,Du musst mir mein Buch zurückgeben."
"zurückkommen,to come back,Wann kommst du zurück?"
"zusammenarbeiten,to cooperate/work together,Die beiden Firmen arbeiten eng zusammen."
"zusammenfassen,to summarize,Fassen Sie den Text bitte kurz zusammen."
"zustimmen,to agree,Ich stimme dir voll und ganz zu."