"Verbo Alemão,English Translation,Exemplo Alemão"
"abfahren,to depart/leave,Der Zug fährt um 8 Uhr ab."
"anrufen,to call,Ich rufe dich später an."
"beginnen,to begin,Der Unterricht beginnt um 9 Uhr."
"bekommen,to receive/get,Ich habe ein Geschenk bekommen."
"bleiben,to stay,Ich bleibe heute zu Hause."
"bringen,to bring,Kannst du mir bitte das Buch bringen?"
"denken,to think,Ich denke an dich."
"essen,to eat,Wir essen gerne Pizza."
"fahren,""to drive, go"",Ich fahre mit dem Auto zur Arbeit."
"fangen,to catch,Die Katze fängt eine Maus."
"finden,to find,Ich kann meine Schlüssel nicht finden."
"fliegen,to fly,Wir fliegen im Sommer nach Spanien."
"geben,to give,Gib mir bitte den Stift."
"gehen,""to go, walk"",Ich gehe zu Fuß zur Schule."
"haben,to have,Ich habe einen Hund."
"halten,""to hold, stop"",Halte bitte meine Tasche."
"helfen,to help,Kannst du mir bitte helfen?"
"kennen,to know (a person/place),Ich kenne diesen Mann nicht."
"kommen,to come,Wann kommst du nach Hause?"
"laufen,""to run, walk"",Ich laufe jeden Morgen im Park."
"lesen,to read,Ich lese gerne Bücher."
"liegen,to lie/be located,Das Buch liegt auf dem Tisch."
"nehmen,to take,Ich nehme einen Kaffee."
"rufen,""to call, shout"",Rufe bitte den Arzt."
"schlafen,to sleep,Ich schlafe normalerweise 8 Stunden."
"schreiben,to write,Ich schreibe einen Brief an meine Oma."
"schwimmen,to swim,Im Sommer schwimmen wir im See."
"sehen,to see,Ich kann den Berg von hier aus sehen."
"sein,to be,Ich bin Student."
"singen,to sing,Sie singt sehr schön."
"sitzen,to sit,Wir sitzen auf der Parkbank."
"sprechen,to speak,Ich spreche Deutsch und Englisch."
"stehen,to stand,Die Vase steht auf dem Tisch."
"tragen,""to carry, wear"",Er trägt einen schweren Koffer."
"treffen,to meet,Ich treffe mich mit Freunden im Café."
"trinken,to drink,Was möchtest du trinken?"
"tun,to do,Was tust du gerade?"
"verlassen,to leave/abandon,Er hat die Stadt verlassen."
"verstehen,to understand,Ich verstehe die Frage nicht."
"werden,to become,Sie will Ärztin werden."
"wissen,to know (a fact),Ich weiß die Antwort nicht."
"wohnen,to live/reside,Ich wohne in Berlin."
"ziehen,""to pull, move"",Wir ziehen nächste Woche um."
"abfliegen,to take off/depart (by air),Das Flugzeug fliegt um 10 Uhr ab."
"abgeben,to hand in/submit,Bitte geben Sie Ihre Hausaufgaben ab."
"abhängen,to depend on,Das hängt vom Wetter ab."
"abholen,to pick up,Ich hole dich vom Bahnhof ab."
"abnehmen,to lose weight/decrease,Er hat 5 Kilo abgenommen."
"abschließen,to lock/finish,Hast du die Tür abgeschlossen?"
"abstellen,to park/turn off,Stell den Motor bitte ab."
"achten,to pay attention to,Achte auf den Verkehr!"
"ändern,to change/alter,Wir müssen den Plan ändern."
"anbieten,to offer,Darf ich Ihnen einen Kaffee anbieten?"
"anerkennen,to recognize/acknowledge,Sie erkannte seine Leistung an."
"anfangen,to start/begin,Wann fängt der Film an?"
"angeben,to state/specify,Bitte geben Sie Ihren Namen an."
"ankommen,to arrive,Der Zug kommt pünktlich an."
"annehmen,to accept/assume,Ich nehme Ihr Angebot an."
"anpassen,to adapt/adjust,Man muss sich an neue Situationen anpassen."
"anschauen,to look at/watch,Wir schauen uns einen Film an."
"antworten,to answer,Bitte antworte auf meine Frage."
"anziehen,to put on/dress,Zieh dir eine Jacke an, es ist kalt."
"arbeiten,to work,Ich arbeite bei einer großen Firma."
"atmen,to breathe,Vergiss nicht zu atmen."
"auffallen,to stand out/be noticeable,Sein rotes Auto fällt sofort auf."
"aufführen,to perform,Die Schüler führen ein Theaterstück auf."
"aufgeben,to give up,Gib niemals deine Träume auf."
"aufheben,to pick up/lift,Kannst du den Stift aufheben?"
"aufhören,to stop/quit,Hör auf zu rauchen!"
"aufmachen,to open,Mach bitte das Fenster auf."
"aufnehmen,to record/admit,Die Kamera nimmt alles auf."
"aufräumen,to clean up,Ich muss mein Zimmer aufräumen."
"aufstehen,to get up,Ich stehe jeden Tag um 6 Uhr auf."
"auftreten,to appear/occur,Plötzlich trat ein Problem auf."
"aufwachen,to wake up,Ich wache ohne Wecker auf."
"ausdrücken,to express,Er kann seine Gefühle gut ausdrücken."
"ausfallen,to be cancelled,Das Konzert ist ausgefallen."
"ausgeben,to spend (money),Ich gebe nicht gern viel Geld aus."
"ausgehen,to go out,Wir gehen heute Abend aus."
"aushalten,to endure/bear,Ich kann diesen Lärm nicht aushalten."
"auskennen,to be familiar with,Kennst du dich hier aus?"
"ausmachen,to turn off,Mach das Licht aus, bevor du gehst."
"ausruhen,to rest,Nach der Arbeit ruhe ich mich aus."
"aussehen,to look/appear,Du siehst heute gut aus."
"aussprechen,to pronounce,Wie spricht man dieses Wort aus?"
"aussteigen,to get off/out,Wir steigen an der nächsten Haltestelle aus."
"auswählen,to choose/select,Sie können ein Gericht aus der Karte auswählen."
"ausziehen,to move out/undress,Nächsten Monat ziehe ich aus."
"backen,to bake,Ich backe einen Kuchen zum Geburtstag."
"baden,to bathe/swim,Im Sommer baden wir im See."
"bauen,to build,Sie bauen ein neues Haus."
"beachten,to note/observe,Bitte beachten Sie die Regeln."
"beantragen,to apply for,Ich möchte ein Visum beantragen."
"beantworten,to answer/reply to,Er hat meine E-Mail noch nicht beantwortet."
"bedeuten,to mean/signify,Was bedeutet dieses Wort?"
"bedienen,to serve,Der Kellner bedient die Gäste."
"beeinflussen,to influence,Werbung beeinflusst unsere Entscheidungen."
"beenden,to finish/end,Wir müssen das Projekt bis Freitag beenden."
"befinden,to be located,Das Hotel befindet sich im Stadtzentrum."
"befreien,to free/liberate,Sie befreiten die Geiseln."
"begegnen,to meet/encounter,Ich bin ihm zufällig auf der Straße begegnet."
"behalten,to keep,Du kannst das Buch behalten."
"behandeln,to treat/deal with,Der Arzt behandelt den Patienten."
"behaupten,to claim/assert,Er behauptet, die Wahrheit zu sagen."
"beißen,to bite,Der Hund beißt nicht."
"beitragen,to contribute,Jeder kann zum Umweltschutz beitragen."
"bekämpfen,to fight/combat,Wir müssen die Armut bekämpfen."
"benutzen,to use,Darf ich Ihr Telefon benutzen?"
"beraten,to advise,Ein Anwalt hat mich beraten."
"berichten,to report,Die Zeitung berichtet über den Unfall."
"berücksichtigen,to consider,Bitte berücksichtigen Sie alle Fakten."
"beruhigen,to calm down,Beruhige dich, alles wird gut."
"beschäftigen,to employ/occupy,Diese Frage beschäftigt mich sehr."
"beschreiben,to describe,Kannst du den Weg beschreiben?"
"beschweren,to complain,Er beschwert sich immer über das Wetter."
"besetzen,to occupy,Der Platz ist schon besetzt."
"besichtigen,to visit/view,Wir wollen das Schloss besichtigen."
"besitzen,to own/possess,Er besitzt ein schnelles Auto."
"bestellen,to order,Ich möchte eine Pizza bestellen."
"bestimmen,to determine/decide,Der Preis wird durch die Nachfrage bestimmt."
"bestrafen,to punish,Der Lehrer bestraft den Schüler."
"besuchen,to visit,Ich besuche meine Großeltern am Wochenende."
"betonen,to emphasize,Ich möchte betonen, wie wichtig das ist."
"betrachten,to look at/consider,Ich betrachte ihn als meinen Freund."
"betrügen,to cheat/deceive,Er hat sie mit einer anderen Frau betrogen."
"bewegen,to move,Beweg dich nicht!"
"beweisen,to prove,Er konnte seine Unschuld beweisen."
"bewerben,to apply,Ich bewerbe mich um eine neue Stelle."
"bezahlen,to pay,Ich bezahle die Rechnung."
"beziehen,to refer to/cover,Meine Frage bezieht sich auf den letzten Punkt."
"bieten,to offer/provide,Die Firma bietet gute Arbeitsbedingungen."
"bilden,to form/educate,Diese Felsen bilden eine interessante Form."
"bitten,to ask for,Ich bitte dich um einen Gefallen."
"brauchen,to need,Ich brauche deine Hilfe."
"brechen,to break,Er hat sich das Bein gebrochen."
"bremsen,to brake,Du musst hier bremsen!"
"brennen,to burn,Das Feuer brennt im Kamin."
"buchen,to book,Ich habe einen Flug nach Rom gebucht."
"buchstabieren,to spell,Können Sie bitte Ihren Namen buchstabieren?"
"danken,to thank,Ich danke Ihnen für Ihre Hilfe."
"darstellen,to represent/portray,Das Bild stellt eine Landschaft dar."
"dauern,to last/take time,Wie lange dauert der Flug?"
"decken,to set (the table)/cover,Kannst du bitte den Tisch decken?"
"demonstrieren,to demonstrate/protest,Die Leute demonstrieren für ihre Rechte."
"dienen,to serve,Womit kann ich Ihnen dienen?"
"diskutieren,to discuss,Wir müssen dieses Thema diskutieren."
"drehen,to turn/spin,Dreh den Schlüssel nach rechts."
"drucken,to print,Ich muss dieses Dokument drucken."
"drücken,to push/press,Drück den Knopf, um die Tür zu öffnen."
"dürfen,to be allowed to/may,Darf ich hier parken?"
"einatmen,to inhale,Atmen Sie tief ein."
"einfallen,to come to mind,Mir fällt sein Name nicht ein."
"einführen,to introduce,Die Firma hat ein neues Produkt eingeführt."
"einladen,to invite,Ich möchte dich zu meiner Party einladen."
"einnehmen,to take (medicine),Nehmen Sie die Tabletten dreimal täglich ein."
"einpacken,to pack,Ich muss meinen Koffer packen."
"einrichten,to furnish/set up,Wir richten unsere neue Wohnung ein."
"einschlafen,to fall asleep,Ich konnte gestern nicht einschlafen."
"einschalten,to turn on,Schalte bitte den Fernseher ein."
"einsteigen,to get on/board,Bitte schnell einsteigen, der Zug fährt gleich ab."
"eintippen,to type in,Tippen Sie Ihr Passwort ein."
"eintreten,to enter,Bitte treten Sie ein."
"einverstanden sein,to agree,Ich bin mit dem Vorschlag einverstanden."
"einzahlen,to deposit,Ich muss Geld auf mein Konto einzahlen."
"empfangen,to receive,Wir haben Ihre Nachricht empfangen."
"empfehlen,to recommend,Welches Restaurant können Sie empfehlen?"
"empfinden,to feel/perceive,Ich empfinde große Freude."
"entdecken,to discover,Kolumbus hat Amerika entdeckt."
"entfernen,to remove,Bitte entfernen Sie Ihre Schuhe."
"enthalten,to contain,Die Schokolade enthält Nüsse."
"entlassen,to dismiss/fire,Er wurde aus dem Krankenhaus entlassen."
"entscheiden,to decide,Ich kann mich nicht entscheiden."
"entschuldigen,to excuse/apologize,Entschuldigen Sie bitte die Störung."
"entspannen,to relax,Im Urlaub kann ich mich gut entspannen."
"entstehen,to originate/arise,Wie ist dieses Missverständnis entstanden?"
"enttäuschen,to disappoint,Sein Verhalten hat mich sehr enttäuscht."
"entwickeln,to develop,Die Firma entwickelt eine neue Software."
"erfahren,to experience/learn,Ich habe es aus der Zeitung erfahren."
"erfinden,to invent,Wer hat das Telefon erfunden?"
"erfüllen,to fulfill,Ich hoffe, deine Wünsche erfüllen sich."
"erhalten,to receive/obtain,Ich habe einen Brief erhalten."
"erhöhen,to increase/raise,Die Preise werden erhöht."
"erinnern,to remember,Ich kann mich nicht an seinen Namen erinnern."
"erkälten,to catch a cold,Ich habe mich erkältet."
"erkennen,to recognize,Ich habe dich an deiner Stimme erkannt."
"erklären,to explain,Kannst du mir die Grammatik erklären?"
"erlauben,to allow/permit,Rauchen ist hier nicht erlaubt."
"erleben,to experience,Wir haben im Urlaub viel erlebt."
"erledigen,to take care of/get done,Ich muss noch einige Dinge erledigen."
"erreichen,to reach/achieve,Wir haben unser Ziel erreicht."
"erscheinen,to appear,Die Sonne erscheint am Horizont."
"erschrecken,to frighten/be frightened,Der laute Knall hat mich erschreckt."
"erwarten,to expect,Ich erwarte einen Anruf."
"erzählen,to tell/narrate,Erzähl mir eine Geschichte!"
"erziehen,to educate/bring up,Sie hat ihre Kinder gut erzogen."
"fehlen,to be missing,Du hast mir gefehlt."
"feiern,to celebrate,Wir feiern heute meinen Geburtstag."
"feststellen,to determine/notice,Ich habe festgestellt, dass etwas nicht stimmt."
"filmen,to film,Er filmt die ganze Zeremonie."
"flattern,to flutter,Die Schmetterlinge flattern in der Luft."
"folgen,to follow,Folgen Sie mir bitte."
"fordern,to demand,Die Arbeiter fordern höhere Löhne."
"fotografieren,to photograph,Ich fotografiere gerne die Natur."
"fragen,to ask,Darf ich Sie etwas fragen?"
"freuen,to be happy/look forward to,Ich freue mich auf das Wochenende."
"fühlen,to feel,Wie fühlen Sie sich heute?"
"führen,to lead/guide,Der Reiseführer führt die Gruppe durch die Stadt."
"füllen,to fill,Füllen Sie bitte das Formular aus."
"funktionieren,to work/function,Mein Computer funktioniert nicht mehr."
"fürchten,to fear,Ich fürchte mich vor Spinnen."
"garantieren,to guarantee,Wir garantieren die beste Qualität."
"gefallen,to be pleasing to/like,Das neue Kleid gefällt mir sehr gut."
"gehorchen,to obey,Hunde müssen ihren Besitzern gehorchen."
"gehören,to belong to,Wem gehört diese Jacke?"
"gelingen,to succeed,Es ist mir gelungen, das Problem zu lösen."
"gelten,to be valid,Diese Fahrkarte gilt für den ganzen Tag."
"genießen,to enjoy,Genießen Sie Ihren Urlaub!"
"genügen,to be enough/suffice,Das Geld genügt nicht."
"geschehen,to happen/occur,Was ist hier geschehen?"
"gestalten,to design/shape,Sie gestaltet ihre eigene Kleidung."
"gestehen,to confess,Der Dieb hat alles gestanden."
"gewinnen,to win,Wer hat das Spiel gewonnen?"
"gewöhnen,to get used to,Ich kann mich nicht an das kalte Wetter gewöhnen."
"glauben,to believe/think,Ich glaube, es wird heute regnen."
"gleichen,to resemble/be equal to,Er gleicht seinem Bruder sehr."
"graben,to dig,Der Hund gräbt ein Loch im Garten."
"gratulieren,to congratulate,Ich gratuliere dir zum Geburtstag."
"greifen,to grab/seize,Er griff nach dem Buch."
"gründen,to found/establish,Sie haben eine neue Firma gegründet."
"grüßen,to greet,Bitte grüße deine Eltern von mir."
"gucken,to look/watch,Guck mal, ein Regenbogen!"
"heiraten,to marry,Sie werden nächstes Jahr heiraten."
"heißen,to be called,Wie heißen Sie?"
"herausfinden,to find out,Ich muss herausfinden, wann der Zug fährt."
"herstellen,to produce/manufacture,Diese Fabrik stellt Autos her."
"herunterladen,to download,Du kannst die Software kostenlos herunterladen."
"hoffen,to hope,Ich hoffe, du kommst bald."
"holen,to get/fetch,Ich hole schnell die Post."
"hören,to hear/listen,Hörst du die Musik?"
"informieren,to inform,Bitte informieren Sie mich über Änderungen."
"installieren,to install,Ich muss ein neues Programm installieren."
"interessieren,to interest,Das Thema interessiert mich sehr."
"irren,to be mistaken,Entschuldigung, da habe ich mich geirrt."
"jagen,to hunt,In diesem Wald darf man nicht jagen."
"joggen,to jog,Er geht jeden Morgen joggen."
"kämpfen,to fight,Sie kämpfen für die Freiheit."
"kaufen,to buy,Ich kaufe Brot im Supermarkt."
"kennenlernen,to get to know,Ich möchte deine Freunde kennenlernen."
"klagen,to complain/sue,Sie klagt über Kopfschmerzen."
"klappen,to work out/go well,Ich hoffe, es klappt alles."
"klären,to clarify,Wir müssen dieses Missverständnis klären."
"kleben,to stick/glue,Kleb die Briefmarke auf den Umschlag."
"klettern,to climb,Die Kinder klettern auf den Baum."
"klingen,to sound,Das klingt nach einer guten Idee."
"klopfen,to knock,Jemand klopft an die Tür."
"kochen,to cook,Ich koche heute Abend Pasta."
"kombinieren,to combine,Man kann diese Farben gut kombinieren."
"konzentrieren,to concentrate,Ich muss mich auf meine Arbeit konzentrieren."
"kopieren,to copy,Kannst du mir diese Dokumente kopieren?"
"korrigieren,to correct,Der Lehrer korrigiert die Fehler."
"kosten,to cost,Was kostet dieses Buch?"
"kriegen,to get,Was kriegst du zum Geburtstag?"
"kritisieren,to criticize,Man sollte nicht immer alles kritisieren."
"kündigen,to resign/terminate,Er hat seinen Job gekündigt."
"küssen,to kiss,Sie küssten sich zum Abschied."
"lächeln,to smile,Sie lächelte freundlich."
"lachen,to laugh,Wir haben viel gelacht."
"laden,to load/charge,Ich muss mein Handy laden."
"landen,to land,Das Flugzeug ist sicher gelandet."
"lassen,to let/leave,Lass uns ins Kino gehen."
"leben,to live,Wo leben deine Großeltern?"
"legen,to lay/put down,Leg das Buch auf den Tisch."
"lehren,to teach,Er lehrt Deutsch an einer Universität."
"leiden,to suffer,Er leidet an einer seltenen Krankheit."
"leihen,to lend/borrow,Kannst du mir Geld leihen?"
"leisten,to achieve/afford,Das kann ich mir nicht leisten."
"leiten,to lead/manage,Sie leitet die Marketingabteilung."
"lernen,to learn,Ich lerne Spanisch."
"lieben,to love,Ich liebe dich."
"liefern,to deliver,Der Postbote liefert die Pakete."
"loben,to praise,Der Chef hat seine Mitarbeiter gelobt."
"lösen,to solve,Wir müssen dieses Rätsel lösen."
"lügen,to lie,Du sollst nicht lügen."
"malen,to paint,Sie malt wunderschöne Bilder."
"meinen,to mean/think,Was meinst du dazu?"
"melden,to report,Bitte melden Sie sich an der Rezeption."
"merken,to notice/memorize,Ich kann mir keine Zahlen merken."
"messen,to measure,Wir müssen die Temperatur messen."
"mieten,to rent,Wir haben ein Auto für das Wochenende gemietet."
"mitbringen,to bring along,Bring bitte etwas zu trinken mit."
"mitkommen,to come along,Kommt ihr mit ins Kino?"
"mitmachen,to join in/participate,Wer möchte bei dem Spiel mitmachen?"
"mitnehmen,to take with,Nimm einen Regenschirm mit, es könnte regnen."
"mitteilen,to inform/communicate,Bitte teilen Sie uns Ihre neue Adresse mit."
"mögen,to like,Ich mag Schokolade."
"müssen,to have to/must,Ich muss jetzt gehen."
"nachdenken,to think about/reflect,Ich muss über dein Angebot nachdenken."
"nähen,to sew,Meine Großmutter hat mir das Nähen beigebracht."
"nennen,to name/call,Kannst du mir drei deutsche Städte nennen?"
"nutzen,to use/utilize,Wir sollten die Zeit sinnvoll nutzen."
"öffnen,to open,Öffnen Sie bitte die Tür."
"organisieren,to organize,Sie organisiert eine große Party."
"packen,to pack,Hast du schon deinen Koffer gepackt?"
"parken,to park,Hier dürfen Sie nicht parken."
"passen,to fit,Die Schuhe passen mir nicht."
"passieren,to happen,Was ist passiert?"
"planen,to plan,Wir planen unseren nächsten Urlaub."
"probieren,to try/taste,Möchtest du den Wein probieren?"
"produzieren,to produce,Die Firma produziert hochwertige Möbel."
"profitieren,to profit/benefit,Von diesem Abkommen profitieren beide Seiten."
"protestieren,to protest,Die Studenten protestieren gegen die hohen Gebühren."
"prüfen,to check/examine,Bitte prüfen Sie die Rechnung sorgfältig."
"putzen,to clean,Ich muss das Badezimmer putzen."
"raten,to advise/guess,Was rätst du mir?"
"rauchen,to smoke,Rauchen ist ungesund."
"reagieren,to react,Er hat nicht auf meinen Brief reagiert."
"realisieren,to realize,Jetzt realisiere ich meinen Fehler."
"rechnen,to calculate,Ich kann gut im Kopf rechnen."
"reden,to talk/speak,Lass uns später darüber reden."
"reduzieren,to reduce,Wir müssen unsere Kosten reduzieren."
"regeln,to regulate/settle,Das müssen wir unter uns regeln."
"regnen,to rain,Es regnet den ganzen Tag."
"reichen,to be enough/reach,Das Essen reicht für alle."
"reinigen,to clean,Die Kleidung muss chemisch gereinigt werden."
"reisen,to travel,Ich reise gerne in andere Länder."
"reiten,to ride (a horse),Als Kind habe ich reiten gelernt."
"rennen,to run/race,Die Kinder rennen über die Wiese."
"reparieren,to repair,Kannst du mein Fahrrad reparieren?"
"reservieren,to reserve,Ich möchte einen Tisch für zwei Personen reservieren."
"retten,to save/rescue,Der Feuerwehrmann hat das Kind gerettet."
"riechen,to smell,Die Blumen riechen gut."
"sammeln,to collect,Ich sammle Briefmarken."
"schaden,to harm/damage,Rauchen schadet der Gesundheit."
"schaffen,to manage/create,Wir schaffen das zusammen!"
"schalten,to switch,Schalte bitte das Licht ein."
"schätzen,to estimate/appreciate,Ich schätze, es sind ungefähr 100 Leute hier."
"schauen,to look/watch,Schau mal, was ich gefunden habe!"
"scheinen,to shine/seem,Die Sonne scheint."
"schenken,to give (as a gift),Ich schenke meiner Mutter Blumen."
"schicken,to send,Ich schicke dir eine E-Mail."
"schieben,to push,Hilf mir, den Tisch zu schieben."
"schießen,to shoot,Er hat ein Tor geschossen."
"schlagen,to hit/beat,Schlag die Eier in die Schüssel."
"schließen,to close,Bitte schließen Sie die Tür leise."
"schmecken,to taste,Die Suppe schmeckt sehr gut."
"schneiden,to cut,Ich muss mir die Haare schneiden lassen."
"schneien,to snow,Im Winter schneit es oft."
"schreien,to shout/scream,Schrei nicht so laut!"
"schwören,to swear,Ich schwöre, dass ich die Wahrheit sage."
"senden,to send,Wir senden Ihnen die Unterlagen per Post."
"setzen,to set/put,Setzen Sie sich bitte."
"sichern,to secure/save,Vergiss nicht, deine Arbeit zu sichern."
"sinken,to sink,Das Schiff ist im Sturm gesunken."
"sollen,to should/be supposed to,Du sollst deine Hausaufgaben machen."
"sparen,to save,Ich spare Geld für ein neues Auto."
"spielen,to play,Die Kinder spielen im Garten."
"spülen,to rinse/wash dishes,Nach dem Essen muss ich spülen."
"spüren,to feel,Ich spüre, dass etwas nicht in Ordnung ist."
"starten,to start,Das Rennen startet um 15 Uhr."
"stattfinden,to take place,Das Konzert findet morgen statt."
"staubsaugen,to vacuum,Ich muss das Wohnzimmer staubsaugen."
"stechen,to sting/prick,Eine Biene hat mich gestochen."
"stecken,to put/stick,Steck den Schlüssel ins Schloss."
"stehlen,to steal,Jemand hat mein Fahrrad gestohlen."
"steigen,to climb/rise,Die Preise steigen ständig."
"stellen,to place/put upright,Stell die Flasche auf den Tisch."
"sterben,to die,Sein Großvater ist letztes Jahr gestorben."
"stimmen,to be correct,Das stimmt nicht."
"stören,to disturb,Bitte stör mich nicht bei der Arbeit."
"streiten,to argue,Die Geschwister streiten sich oft."
"studieren,to study,Ich studiere Medizin in Berlin."
"suchen,to search/look for,Was suchst du?"
"tanzen,to dance,Tanzen wir?"
"teilen,to share,Teilen wir uns die Pizza?"
"teilnehmen,to participate,Möchtest du am Wettbewerb teilnehmen?"
"telefonieren,to talk on the phone,Ich habe lange mit meiner Freundin telefoniert."
"töten,to kill,Man darf keine Tiere töten."
"trainieren,to train/practice,Ich trainiere dreimal pro Woche im Fitnessstudio."
"träumen,to dream,Ich habe von dir geträumt."
"trennen,to separate,Wir müssen den Müll trennen."
"treten,to step/kick,Tritt nicht auf den Rasen!"
"trocknen,to dry,Die Wäsche trocknet in der Sonne."
"überlegen,to consider/think over,Ich muss mir das noch einmal überlegen."
"übernachten,to stay overnight,Wir haben im Hotel übernachtet."
"übernehmen,to take over,Sie wird die Leitung des Projekts übernehmen."
"überprüfen,to check/review,Bitte überprüfen Sie Ihre Antworten."
"überraschen,to surprise,Sein Besuch hat uns überrascht."
"übersetzen,to translate,Kannst du diesen Satz ins Englische übersetzen?"
"überweisen,to transfer (money),Ich muss die Miete überweisen."
"überzeugen,to convince,Er konnte mich nicht überzeugen."
"umarmen,to hug/embrace,Sie umarmten sich herzlich."
"umsteigen,to change (trains, etc.),In Frankfurt müssen wir umsteigen."
"umziehen,to move (house),Nächstes Jahr ziehen wir nach Hamburg um."
"unterhalten,to entertain/talk,Wir haben uns lange unterhalten."
"unternehmen,to undertake,Was wollen wir am Wochenende unternehmen?"
"unterscheiden,to distinguish,Kannst du die Zwillinge unterscheiden?"
"unterschreiben,to sign,Bitte unterschreiben Sie hier."
"untersuchen,to investigate/examine,Der Arzt hat mich gründlich untersucht."
"verbessern,to improve,Ich möchte mein Deutsch verbessern."
"verbieten,to forbid,Der Zutritt ist für Unbefugte verboten."
"verbinden,to connect/link,Können Sie mich mit Herrn Müller verbinden?"
"verbringen,to spend (time),Wir haben unseren Urlaub am Meer verbracht."
"verdienen,to earn/deserve,Er verdient viel Geld."
"vergessen,to forget,Ich habe meinen Schlüssel vergessen."
"vergleichen,to compare,Vergleichen Sie die Preise, bevor Sie etwas kaufen."
"vergrößern,to enlarge/increase,Können Sie das Bild vergrößern?"
"verhalten,to behave,Verhalte dich bitte anständig!"
"verkaufen,to sell,Ich verkaufe mein altes Auto."
"verlängern,to extend/lengthen,Ich möchte mein Visum verlängern."
"verlieren,to lose,Ich will dieses Spiel nicht verlieren."
"vermeiden,to avoid,Versuchen Sie, Fehler zu vermeiden."
"vermieten,to rent out,Sie vermietet eine Wohnung im Stadtzentrum."
"vermissen,to miss,Ich vermisse meine Familie."
"vermuten,to assume/suspect,Ich vermute, dass er nicht kommen wird."
"veröffentlichen,to publish,Der Autor hat ein neues Buch veröffentlicht."
"verraten,to betray/reveal,Verrate mir dein Geheimnis nicht!"
"verschieben,to postpone/move,Wir müssen den Termin verschieben."
"verschwinden,to disappear,Mein Stift ist verschwunden."
"versprechen,to promise,Ich verspreche, dir zu helfen."
"verstecken,to hide,Die Kinder verstecken sich im Garten."
"versuchen,to try/attempt,Ich versuche, pünktlich zu sein."
"verteidigen,to defend,Der Anwalt verteidigt seinen Mandanten."
"verteilen,to distribute,Der Lehrer verteilt die Arbeitsblätter."
"vertragen,to tolerate/stand,Ich vertrage keine Milch."
"vertrauen,to trust,Ich vertraue dir vollkommen."
"verursachen,to cause,Der Sturm hat große Schäden verursacht."
"verwenden,to use,Welches Waschmittel verwendest du?"
"verzeihen,to forgive,Ich kann dir nicht verzeihen."
"vorbereiten,to prepare,Ich muss mich auf die Prüfung vorbereiten."
"vorgehen,to proceed,Wie sollen wir jetzt vorgehen?"
"vorhaben,to intend/plan,Was hast du am Wochenende vor?"
"vorstellen,to introduce/imagine,Darf ich mich vorstellen?"
"wachsen,to grow,Die Blumen wachsen schnell."
"wählen,to choose/vote,Welches Kleid wählst du?"
"wandern,to hike,Wir gehen am Sonntag im Wald wandern."
"warten,to wait,Bitte warten Sie einen Moment."
"waschen,to wash,Ich muss meine Wäsche waschen."
"wechseln,to change/exchange,Ich möchte Geld wechseln."
"wecken,to wake up (someone),Kannst du mich morgen um 7 Uhr wecken?"
"wegwerfen,to throw away,Wirf den Müll bitte weg."
"weinen,to cry,Das kleine Kind weint."
